<execution xmlns="exec"
    xmlns:xsi="http://www.w3.org/2001/XMLSchema-instance"
    xsi:schemaLocation="exec validation/execution.xsd">
    <iterations>3</iterations>
    <defaultTimeout>500</defaultTimeout>
    <distributionAlgorithm>SingleExecution</distributionAlgorithm>
    <rebootPerTest>false</rebootPerTest>
    <rebootNewBoxes>false</rebootNewBoxes>
    <manualInspection>false</manualInspection>
    <stopWhenAllDead>true</stopWhenAllDead>
</execution>
